[
  {
    "schema_version": "pineland.partner_force_autonomy_raw_branch.v2",
    "experiment_id": "PLUMBING_ONLY",
    "design_version": "pineland.partner_force_autonomy_stage3_discovery_design.v1",
    "git_commit": "fixture-not-a-result",
    "world_id": "fixture_s9001",
    "pair_id": "fixture_s9001_h7",
    "run_id": "fixture_s9001_h7_SUPPORT_ON",
    "cell_id": "fixture_neutral",
    "support_profile": "none",
    "seed": 9001,
    "withdrawal_time_days": 120,
    "horizon_days": 7,
    "branch": "SUPPORT_ON",
    "indigenous_forcegen_multiplier": 1.0,
    "indigenous_logistics_multiplier": 1.0,
    "indigenous_command_multiplier": 1.0,
    "pre_insurgent_personnel": 500.0,
    "pre_insurgent_active_formations": 5,
    "pre_insurgent_territorial_control": 0.05,
    "pre_recent_actions": 0,
    "pre_contested_localities": 2,
    "pre_supported_capability": 0.7,
    "pre_government_control": 0.55,
    "pre_military_personnel": 1000,
    "pre_trained_reserve": 100,
    "pre_recruit_pipeline": 50,
    "pre_readiness": 0.7,
    "pre_experience": 0.5,
    "pre_supply_stock": 5000,
    "pre_supply_capacity": 10000,
    "pre_command_reliability": 0.7,
    "pre_command_latency_hours": 4.0,
    "window_indigenous_recruits": 20,
    "window_indigenous_graduates": 15,
    "window_military_losses": 10,
    "window_indigenous_logistics_produced": 1000,
    "window_indigenous_logistics_delivered": 900,
    "window_indigenous_logistics_consumed": 800,
    "window_external_air_intensity": 0.0,
    "window_external_logistics_offered": 0.0,
    "window_external_logistics_delivered": 0.0,
    "window_external_logistics_rejected": 0.0,
    "window_external_logistics_lost": 0.0,
    "window_external_command_events": 0,
    "window_command_latency_hours_saved": 0.0,
    "window_external_forcegen_graduates": 0.0,
    "window_donor_cost_air": 0.0,
    "window_donor_cost_logistics": 0.0,
    "window_donor_cost_command": 0.0,
    "window_donor_cost_forcegen": 0.0,
    "window_donor_cost": 0.0,
    "support_air_intensity": 0.0,
    "support_air_bonus": 0.0,
    "support_logistics_rate": 0.0,
    "support_command_reliability_boost": 0.0,
    "support_command_latency_reduction_fraction": 0.0,
    "support_forcegen_training_rate_boost": 0.0,
    "c_government_control": 0.55,
    "c_military_personnel_retention": 0.95,
    "c_operational_formation_survival": 1.0,
    "c_geographic_coverage_retention": 1.0,
    "composite_capability": 0.85,
    "post_indigenous_recruits": 5,
    "post_indigenous_graduates": 4,
    "post_military_losses": 3,
    "post_indigenous_logistics_produced": 300,
    "post_indigenous_logistics_consumed": 250,
    "post_donor_cost_air": 0.0,
    "post_donor_cost_logistics": 0.0,
    "post_donor_cost_command": 0.0,
    "post_donor_cost_forcegen": 0.0,
    "post_donor_cost": 0.0
  },
  {
    "schema_version": "pineland.partner_force_autonomy_raw_branch.v2",
    "experiment_id": "PLUMBING_ONLY",
    "design_version": "pineland.partner_force_autonomy_stage3_discovery_design.v1",
    "git_commit": "fixture-not-a-result",
    "world_id": "fixture_s9001",
    "pair_id": "fixture_s9001_h7",
    "run_id": "fixture_s9001_h7_SUPPORT_OFF",
    "cell_id": "fixture_neutral",
    "support_profile": "none",
    "seed": 9001,
    "withdrawal_time_days": 120,
    "horizon_days": 7,
    "branch": "SUPPORT_OFF",
    "indigenous_forcegen_multiplier": 1.0,
    "indigenous_logistics_multiplier": 1.0,
    "indigenous_command_multiplier": 1.0,
    "pre_insurgent_personnel": 500.0,
    "pre_insurgent_active_formations": 5,
    "pre_insurgent_territorial_control": 0.05,
    "pre_recent_actions": 0,
    "pre_contested_localities": 2,
    "pre_supported_capability": 0.7,
    "pre_government_control": 0.55,
    "pre_military_personnel": 1000,
    "pre_trained_reserve": 100,
    "pre_recruit_pipeline": 50,
    "pre_readiness": 0.7,
    "pre_experience": 0.5,
    "pre_supply_stock": 5000,
    "pre_supply_capacity": 10000,
    "pre_command_reliability": 0.7,
    "pre_command_latency_hours": 4.0,
    "window_indigenous_recruits": 20,
    "window_indigenous_graduates": 15,
    "window_military_losses": 10,
    "window_indigenous_logistics_produced": 1000,
    "window_indigenous_logistics_delivered": 900,
    "window_indigenous_logistics_consumed": 800,
    "window_external_air_intensity": 0.0,
    "window_external_logistics_offered": 0.0,
    "window_external_logistics_delivered": 0.0,
    "window_external_logistics_rejected": 0.0,
    "window_external_logistics_lost": 0.0,
    "window_external_command_events": 0,
    "window_command_latency_hours_saved": 0.0,
    "window_external_forcegen_graduates": 0.0,
    "window_donor_cost_air": 0.0,
    "window_donor_cost_logistics": 0.0,
    "window_donor_cost_command": 0.0,
    "window_donor_cost_forcegen": 0.0,
    "window_donor_cost": 0.0,
    "support_air_intensity": 0.0,
    "support_air_bonus": 0.0,
    "support_logistics_rate": 0.0,
    "support_command_reliability_boost": 0.0,
    "support_command_latency_reduction_fraction": 0.0,
    "support_forcegen_training_rate_boost": 0.0,
    "c_government_control": 0.55,
    "c_military_personnel_retention": 0.95,
    "c_operational_formation_survival": 1.0,
    "c_geographic_coverage_retention": 1.0,
    "composite_capability": 0.85,
    "post_indigenous_recruits": 5,
    "post_indigenous_graduates": 4,
    "post_military_losses": 3,
    "post_indigenous_logistics_produced": 300,
    "post_indigenous_logistics_consumed": 250,
    "post_donor_cost_air": 0.0,
    "post_donor_cost_logistics": 0.0,
    "post_donor_cost_command": 0.0,
    "post_donor_cost_forcegen": 0.0,
    "post_donor_cost": 0.0
  },
  {
    "schema_version": "pineland.partner_force_autonomy_raw_branch.v2",
    "experiment_id": "PLUMBING_ONLY",
    "design_version": "pineland.partner_force_autonomy_stage3_discovery_design.v1",
    "git_commit": "fixture-not-a-result",
    "world_id": "fixture_s9002",
    "pair_id": "fixture_s9002_h30",
    "run_id": "fixture_s9002_h30_SUPPORT_ON",
    "cell_id": "fixture_neutral",
    "support_profile": "none",
    "seed": 9002,
    "withdrawal_time_days": 120,
    "horizon_days": 30,
    "branch": "SUPPORT_ON",
    "indigenous_forcegen_multiplier": 1.0,
    "indigenous_logistics_multiplier": 1.0,
    "indigenous_command_multiplier": 1.0,
    "pre_insurgent_personnel": 520.0,
    "pre_insurgent_active_formations": 5,
    "pre_insurgent_territorial_control": 0.05,
    "pre_recent_actions": 0,
    "pre_contested_localities": 2,
    "pre_supported_capability": 0.7,
    "pre_government_control": 0.55,
    "pre_military_personnel": 1025,
    "pre_trained_reserve": 105,
    "pre_recruit_pipeline": 52,
    "pre_readiness": 0.7,
    "pre_experience": 0.5,
    "pre_supply_stock": 5100,
    "pre_supply_capacity": 10000,
    "pre_command_reliability": 0.7,
    "pre_command_latency_hours": 4.0,
    "window_indigenous_recruits": 21,
    "window_indigenous_graduates": 16,
    "window_military_losses": 11,
    "window_indigenous_logistics_produced": 1010,
    "window_indigenous_logistics_delivered": 910,
    "window_indigenous_logistics_consumed": 810,
    "window_external_air_intensity": 0.0,
    "window_external_logistics_offered": 0.0,
    "window_external_logistics_delivered": 0.0,
    "window_external_logistics_rejected": 0.0,
    "window_external_logistics_lost": 0.0,
    "window_external_command_events": 0,
    "window_command_latency_hours_saved": 0.0,
    "window_external_forcegen_graduates": 0.0,
    "window_donor_cost_air": 0.0,
    "window_donor_cost_logistics": 0.0,
    "window_donor_cost_command": 0.0,
    "window_donor_cost_forcegen": 0.0,
    "window_donor_cost": 0.0,
    "support_air_intensity": 0.0,
    "support_air_bonus": 0.0,
    "support_logistics_rate": 0.0,
    "support_command_reliability_boost": 0.0,
    "support_command_latency_reduction_fraction": 0.0,
    "support_forcegen_training_rate_boost": 0.0,
    "c_government_control": 0.55,
    "c_military_personnel_retention": 0.95,
    "c_operational_formation_survival": 1.0,
    "c_geographic_coverage_retention": 1.0,
    "composite_capability": 0.85,
    "post_indigenous_recruits": 6,
    "post_indigenous_graduates": 5,
    "post_military_losses": 4,
    "post_indigenous_logistics_produced": 310,
    "post_indigenous_logistics_consumed": 260,
    "post_donor_cost_air": 0.0,
    "post_donor_cost_logistics": 0.0,
    "post_donor_cost_command": 0.0,
    "post_donor_cost_forcegen": 0.0,
    "post_donor_cost": 0.0
  },
  {
    "schema_version": "pineland.partner_force_autonomy_raw_branch.v2",
    "experiment_id": "PLUMBING_ONLY",
    "design_version": "pineland.partner_force_autonomy_stage3_discovery_design.v1",
    "git_commit": "fixture-not-a-result",
    "world_id": "fixture_s9002",
    "pair_id": "fixture_s9002_h30",
    "run_id": "fixture_s9002_h30_SUPPORT_OFF",
    "cell_id": "fixture_neutral",
    "support_profile": "none",
    "seed": 9002,
    "withdrawal_time_days": 120,
    "horizon_days": 30,
    "branch": "SUPPORT_OFF",
    "indigenous_forcegen_multiplier": 1.0,
    "indigenous_logistics_multiplier": 1.0,
    "indigenous_command_multiplier": 1.0,
    "pre_insurgent_personnel": 520.0,
    "pre_insurgent_active_formations": 5,
    "pre_insurgent_territorial_control": 0.05,
    "pre_recent_actions": 0,
    "pre_contested_localities": 2,
    "pre_supported_capability": 0.7,
    "pre_government_control": 0.55,
    "pre_military_personnel": 1025,
    "pre_trained_reserve": 105,
    "pre_recruit_pipeline": 52,
    "pre_readiness": 0.7,
    "pre_experience": 0.5,
    "pre_supply_stock": 5100,
    "pre_supply_capacity": 10000,
    "pre_command_reliability": 0.7,
    "pre_command_latency_hours": 4.0,
    "window_indigenous_recruits": 21,
    "window_indigenous_graduates": 16,
    "window_military_losses": 11,
    "window_indigenous_logistics_produced": 1010,
    "window_indigenous_logistics_delivered": 910,
    "window_indigenous_logistics_consumed": 810,
    "window_external_air_intensity": 0.0,